Question,Answer
1. What is correlation in statistics and why is it important?,"Correlation in statistics is a measure that expresses the extent to which two variables are linearly related. It is important because it helps identify relationships between variables, make predictions, and develop causal models. Correlation can be used in various fields like business, finance, medicine, and psychology to make better decisions and improve outcomes."
"2. How are correlation coefficients interpreted and what do values of -1, 0, and 1 indicate?","Correlation coefficients range from -1 to 1. 
- A value of 1 indicates a perfect positive linear relationship, meaning the two variables move in the same direction.
- A value of -1 indicates a perfect negative linear relationship, meaning the two variables move in opposite directions.
- A value of 0 indicates no linear relationship between the two variables."
3. How can correlation be used to identify relationships between variables?,"Correlation can be used to identify relationships between variables by measuring the extent to which two variables are linearly related. A correlation coefficient ranging from -1 to 1 indicates the strength and direction of the relationship. A value of 0 indicates no linear relationship, 1 indicates a perfect positive linear relationship, and -1 indicates a perfect negative linear relationship. This information helps in understanding whether there is a positive or negative relationship between the variables, which is useful for analyzing complex systems and identifying patterns."
4. In what ways can correlation be used to make predictions in various fields?,"Correlation can be used to make predictions in various fields by identifying strong relationships between two variables. If there is a strong correlation between two variables, it is possible to use the value of one variable to predict the value of the other variable. This predictive power of correlation can be utilized in fields such as business, finance, medicine, and psychology to forecast outcomes and make informed decisions based on the identified relationships."
5. How can correlation be used to develop causal models?,"Correlation can be used as a starting point for developing causal models by identifying relationships between variables. Once a correlation is established between two variables, further research and analysis can be conducted to determine if there is a causal relationship between them. By understanding the strength and direction of the correlation, researchers can investigate potential causal mechanisms and develop models that describe how changes in one variable cause changes in other variables. These causal models can then be used to make more accurate predictions and develop interventions to influence specific variables."
6. What are some fields where correlation is commonly used and how is it applied in each?,"Some fields where correlation is commonly used include:

1. **Business**: Correlation is used to identify relationships between business variables like sales, advertising spending, and customer satisfaction. This information helps in making better business decisions, such as resource allocation for marketing.

2. **Finance**: In finance, correlation is applied to identify relationships between different financial assets like stocks, bonds, and commodities. This helps in building diversified portfolios that reduce risk.

3. **Medicine**: Correlation is used in medicine to identify relationships between medical variables such as risk factors for diseases and treatment effectiveness. This information is crucial for improving disease prevention, diagnosis, and treatment.

4. **Psychology**: In psychology, correlation is used to identify relationships between psychological variables like personality traits, cognitive abilities, and mental disorders. This information aids in developing better psychological assessments and treatments."
"7. Give examples of real-world scenarios where correlation is used, such as in marketing, finance, medicine, and psychology.","In marketing, correlation is used to identify the relationship between advertising spending and sales to allocate resources effectively. In finance, it helps in building diversified stock portfolios by analyzing the correlation between different stocks. In medicine, correlation is used to understand the relationship between risk factors and diseases for better prevention and treatment strategies. In psychology, it helps in identifying relationships between psychological variables like personality traits and mental disorders to develop effective assessments and treatments."
8. Why is it important to note that correlation does not equal causation?,"It is important to note that correlation does not equal causation because just because two variables are correlated, it does not necessarily mean that one variable causes the other. There could be a third variable or underlying factor influencing both variables, leading to a correlation. Understanding this distinction is crucial to avoid making incorrect assumptions or decisions based solely on correlation."
9. What is an example provided in the text to illustrate the concept that correlation does not imply causation?,"An example provided in the text to illustrate the concept that correlation does not imply causation is the correlation between ice cream sales and shark attacks. The text explains that there is a strong correlation between these two variables, but it does not mean that eating ice cream causes shark attacks. Instead, there is likely a third variable, such as hot weather, that causes both ice cream sales and shark attacks to increase."
10. How can correlation be a powerful statistical tool in making decisions and improving outcomes in various fields?,"Correlation can be a powerful statistical tool in making decisions and improving outcomes in various fields for several reasons:

1. **Identifying Relationships**: Correlation helps in identifying relationships between variables, whether they are positive or negative. This information is crucial for understanding how different factors interact within a system.

2. **Predictions**: Strong correlations between variables allow for predictions to be made. By understanding the relationship between variables, one can predict the value of one variable based on the value of another. This predictive ability is valuable in fields like business, finance, and medicine.

3. **Developing Causal Models**: Correlation can serve as a foundation for developing causal models. These models describe how changes in one variable cause changes in others. By understanding these causal relationships, more accurate predictions can be made, and interventions can be developed to influence specific variables positively.

By utilizing correlation in these ways, decision-makers in various fields can make informed choices, predict outcomes, and develop strategies that lead to improved results and outcomes."
